id,title,subtitle,author,matter,editorial,collection,binding,country,lenguage of publication,original lenguage,ISBN,EAN,dimension,weight,number of pages,publication date,price (€),untaxed price (€),book cover
1,Operación Kazán,Premio Primavera de Novela 2022,"Vallés, Vicente",Ficción moderna y contemporanea,Espasa,ESPASA NARRATIVA,Cartoné,España,Castellano,Castellano,978-84-670-6368-4,9788467063684,230 x 150 mm.,624 gramos,424,23-03-2022,"20,90","20,10",https://static.cegal.es/imagenes/marcadas/9788467/978846706368.gif
2,El mentalista,,"Läckberg, Camilla / Fexeus, Henrik",Obra de misterio y suspense,Editorial Planeta,"Conde Fisas, Claudia",,Encuadernación:,País de publicación :,Idioma de publicación :,978-84-08-25519-2,9788408255192,230 x 150 mm.,922 gramos,720,16-03-2022,"23,90","22,98",https://static.cegal.es/imagenes/marcadas/9788408/978840825519.gif
3,El mapa de los anhelos,,"Kellen, Alice",Ficción moderna y contemporanea,Editorial Planeta,(Fuera de colección),Tapa blanda o Bolsillo,España,Castellano,Castellano,978-84-08-25595-6,9788408255956,230 x 150 mm.,560 gramos,496,30-03-2022,"17,90","17,21",https://static.cegal.es/imagenes/marcadas/9788408/978840825595.gif
4,TOKYO REVENGERS 05,,"WAKUI, KEN",Novelas gráficas: manga,NORMA EDITORIAL,TOKYO REVENGERS,Libro en otro formato,España,Castellano,Castellano,978-84-679-4711-3,9788467947113,210 x 140 mm.,200 gramos,374,25-03-2022,"16,00","15,38",https://static.cegal.es/imagenes/marcadas/9788467/978846794711.gif
5,El Libro Negro de las Horas,,"García Sáenz de Urturi, Eva",Obra de misterio y suspense,Editorial Planeta,Autores Españoles e Iberoamericanos,Cartoné,España,Castellano,Castellano,978-84-08-25285-6,9788408252856,230 x 150 mm.,586 gramos,384,02-02-2022,"20,90","20,10",https://static.cegal.es/imagenes/marcadas/9788408/978840825285.gif
6,El castillo de Barbazul,Terra Alta III,"Cercas, Javier",Ficción moderna y contemporanea,Tusquets Editores,Andanzas,Tapa blanda o Bolsillo,España,Castellano,Castellano,978-84-1107-084-3,9788411070843,225 x 148 mm.,580 gramos,400,02-03-2022,"21,90","21,06",https://static.cegal.es/imagenes/marcadas/9788411/978841107084.gif
7,Violeta,,"Allende, Isabel",Ficción moderna y contemporanea,PLAZA & JANES,EXITOS,Cartoné,España,Castellano,Castellano,978-84-01-02747-5,9788401027475,237 x 161 mm.,636 gramos,400,25-01-2022,"22,90","22,02",https://static.cegal.es/imagenes/marcadas/9788401/978840102747.gif
8,Cómo hacer que te pasen cosas buenas,"Entiende tu cerebro, gestiona tus emociones, mejora tu vida","Rojas Estapé, Marian",Autoayuda y desarrollo personal,Espasa,Fuera de colección,Tapa blanda o Bolsillo,España,Castellano,Castellano,978-84-670-5330-2,9788467053302,230 x 150 mm.,278 gramos,232,09-10-2018,"19,90","19,13",https://static.cegal.es/imagenes/marcadas/9788467/978846705330.gif
9,El peligro de estar cuerda,,"Montero, Rosa",Psiquiatría,Seix Barral,Biblioteca Breve,Tapa blanda o Bolsillo,España,Castellano,Castellano,978-84-322-4064-5,9788432240645,230 x 133 mm.,484 gramos,360,30-03-2022,"20,90","20,10",https://static.cegal.es/imagenes/marcadas/9788432/978843224064.gif
10,La muerte contada por un sapiens a un neandertal,,"Millás, Juan José / Arsuaga, Juan Luis",Evolución,ALFAGUARA,Hispánica,Tapa blanda o Bolsillo,España,Castellano,Castellano,978-84-204-6105-2,9788420461052,239 x 154 mm.,477 gramos,312,01-02-2022,"18,90","18,17",https://static.cegal.es/imagenes/marcadas/9788420/978842046105.gif
11,Encuentra tu persona vitamina,,"Rojas Estapé, Marian",Autoayuda y desarrollo personal,Espasa,F. COLECCION,Tapa blanda o Bolsillo,España,Castellano,Castellano,978-84-670-6221-2,9788467062212,230 x 150 mm.,374 gramos,328,25-08-2021,"19,90","19,13",https://static.cegal.es/imagenes/marcadas/9788467/978846706221.gif
12,Las Perrerías de Mike 1. Mikecrack y la Estrella Maldita,,Mikecrack,"Relatos de terror y fantasmas, obras de suspense (infantil/juvenil)",Ediciones Martínez Roca,4You2,Cartoné,España,Castellano,Castellano,978-84-270-4929-1,9788427049291,215 x 140 mm.,566 gramos,192,23-03-2022,"19,90","19,13",https://static.cegal.es/imagenes/marcadas/9788427/978842704929.gif
13,La Bestia,Premio Planeta 2021,"Mola, Carmen",Ficción moderna y contemporanea,Editorial Planeta,Autores Españoles e Iberoamericanos,Cartoné,España,Castellano,Castellano,978-84-08-24984-9,9788408249849,230 x 150 mm.,732 gramos,544,04-11-2021,"22,90","22,02",https://static.cegal.es/imagenes/marcadas/9788408/978840824984.gif
14,Por si las voces vuelven,,"Martín, Ángel",Autoayuda y desarrollo personal,Editorial Planeta,No Ficción,Tapa blanda o Bolsillo,España,Castellano,Castellano,978-84-08-24921-4,9788408249214,230 x 150 mm.,293 gramos,256,17-11-2021,"17,90","17,21",https://static.cegal.es/imagenes/marcadas/9788408/978840824921.gif
15,Cuando éramos ayer,,"Eyre, Pilar",Ficción moderna y contemporanea,Editorial Planeta,Autores Españoles e Iberoamericanos,Cartoné,España,Castellano,Castellano,978-84-08-25473-7,9788408254737,230 x 150 mm.,566 gramos,368,23-03-2022,"20,90","20,10",https://static.cegal.es/imagenes/marcadas/9788408/978840825473.gif
16,Boulevard (Libro 1),Edición revisada por la autora,"Salvador, Flor M.",Ficción general (infantil/juvenil),MONTENA,Wattpad,Tapa blanda o Bolsillo,España,Castellano,Castellano,978-84-19169-18-1,9788419169181,215 x 142 mm.,363 gramos,360,24-02-2022,"15,95","15,34",https://static.cegal.es/imagenes/marcadas/9788419/978841916918.gif
17,Purgatorio,,"Sistiaga, Jon",Obra de misterio y suspense,PLAZA & JANES,Éxitos,Tapa blanda o Bolsillo,España,Castellano,Castellano,978-84-01-02821-2,9788401028212,229 x 154 mm.,544 gramos,416,17-03-2022,"20,90","20,10",https://static.cegal.es/imagenes/marcadas/9788401/978840102821.gif
18,Nosotros en la luna,,"Kellen, Alice",Narrativa romántica adulta y contemporánea,Booket,Novela,Tapa blanda o Bolsillo,España,Castellano,Castellano,978-84-08-23738-9,9788408237389,190 x 125 mm.,310 gramos,480,27-01-2021,"8,95","8,61",https://static.cegal.es/imagenes/marcadas/9788408/978840823738.gif
19,Últimos días en Berlín,Finalista Premio Planeta 2021,"Sánchez-Garnica, Paloma",Ficción moderna y contemporanea,Editorial Planeta,Autores Españoles e Iberoamericanos,Cartoné,España,Castellano,Castellano,978-84-08-24985-6,9788408249856,230 x 150 mm.,854 gramos,648,04-11-2021,"22,90","22,02",https://static.cegal.es/imagenes/marcadas/9788408/978840824985.gif
20,Antes de diciembre,,"Marcús, Joana",Relatos románticos y de relaciones interpersonales (infantil/juvenil),MONTENA,WATTPAD,Tapa blanda o Bolsillo,España,Castellano,Castellano,978-84-18483-44-8,9788418483448,215 x 142 mm.,487 gramos,496,11-11-2021,"17,95","17,26",https://static.cegal.es/imagenes/marcadas/9788418/978841848344.gif
21,Haikyû!! nº 06,,"Furudate, Haruichi",Edad de interés: a partir de 8 años,Planeta Cómic,"Nogués Graell, Sandra",,Encuadernación:,País de publicación :,Idioma de publicación :,978-84-9174-769-7,9788491747697,177 x 111 mm.,206 gramos,192,23-03-2022,"7,95","7,64",https://static.cegal.es/imagenes/marcadas/9788491/978849174769.gif
22,Una historia ridícula,,"Landero, Luis",Ficción moderna y contemporanea,Tusquets Editores S.A.,Andanzas,Tapa blanda o Bolsillo,España,Castellano,Castellano,978-84-1107-069-0,9788411070690,225 x 148 mm.,414 gramos,288,02-02-2022,"19,00","18,27",https://static.cegal.es/imagenes/marcadas/9788411/978841107069.gif
23,La señora March,,"Feito, Virginia",Edad de interés: a partir de 12 años,LUMEN,Narrativa,Tapa blanda o Bolsillo,España,Castellano,Inglés,978-84-264-0965-2,9788426409652,229 x 153 mm.,490 gramos,328,13-01-2022,"19,90","19,13",https://static.cegal.es/imagenes/marcadas/9788426/978842640965.gif
24,Cauterio,,"Lijtmaer, Lucía",Ficción moderna y contemporanea,Editorial Anagrama,Narrativas hispánicas,Tapa blanda o Bolsillo,España,Castellano,Castellano,978-84-339-9946-7,9788433999467,220 x 140 mm.,350 gramos,222,02-03-2022,"18,90","18,17",https://static.cegal.es/imagenes/marcadas/9788433/978843399946.gif
25,Amanda Black 4 - La Campana de Jade,,"Gómez-Jurado, Juan / Montes, Bárbara",Edad de interés: a partir de 8 años,B de Blok,Amanda Black,Cartoné,España,Castellano,Castellano,978-84-18688-27-0,9788418688270,212 x 149 mm.,376 gramos,208,24-03-2022,"14,96","14,38",https://static.cegal.es/imagenes/marcadas/9788418/978841868827.gif
26,El Principito (edición oficial),,"Saint-Exupéry, Antoine de",Edad de interés: a partir de 8 años,Salamandra Infantil y Juvenil,SAINT-EXUPERY ANTOINE,Tapa blanda o Bolsillo,España,Castellano,Francés,978-84-9838-149-8,9788498381498,180 x 113 mm.,128 gramos,96,15-01-2008,"6,95","6,68",https://static.cegal.es/imagenes/marcadas/9788498/978849838149.gif
27,Fleur. Mi desesperada decisión (DARKS 0),,"Godoy, Ariana",Relatos románticos y de relaciones interpersonales (infantil/juvenil),MONTENA,DARKS,Tapa blanda o Bolsillo,España,Castellano,Castellano,978-84-18798-71-9,9788418798719,215 x 140 mm.,340 gramos,336,10-03-2022,"17,95","17,26",https://static.cegal.es/imagenes/marcadas/9788418/978841879871.gif
28,La hipótesis del amor,,"Hazelwood, Ali",Narrativa romántica adulta y contemporánea,Contraluz Editorial,"Sánchez Díez, Ana Isabel",,Encuadernación:,País de publicación :,Idioma de publicación :,978-84-18945-18-2,9788418945182,230 x 160 mm.,646 gramos,488,17-03-2022,"18,95","18,22",https://static.cegal.es/imagenes/marcadas/9788418/978841894518.gif
29,Un cuento perfecto,,"Benavent, Elísabet",Narrativa romántica adulta y contemporánea,DEBOLSILLO,DEBOLSILLO,Tapa blanda o Bolsillo,España,Castellano,Castellano,978-84-663-5481-3,9788466354813,191 x 126 mm.,445 gramos,640,18-02-2021,"9,95","9,57",https://static.cegal.es/imagenes/marcadas/9788466/978846635481.gif
30,Trilogía Fuego 1. Ciudades de humo,,"Marcús, Joana",Relatos románticos y de relaciones interpersonales (infantil/juvenil),Crossbooks,Ficción,Tapa blanda o Bolsillo,España,Castellano,Castellano,978-84-08-25185-9,9788408251859,225 x 145 mm.,746 gramos,496,16-02-2022,"17,95","17,26",https://static.cegal.es/imagenes/marcadas/9788408/978840825185.gif
31,Invisible,,"Moreno, Eloy",Edad de interés: a partir de 12 años,Nube de Tinta,NUBE DE TINTA,Tapa blanda o Bolsillo,España,Castellano,Inglés,978-84-16588-43-5,9788416588435,212 x 141 mm.,352 gramos,304,01-02-2018,"15,95","15,34",https://static.cegal.es/imagenes/marcadas/9788416/978841658843.gif
32,Tormenta en la villa de las telas (La villa de las telas 5),,"Jacobs, Anne",Sagas,PLAZA & JANES,"Guelbenzu De San Eustaquio, Ana",,Encuadernación:,País de publicación :,Idioma de publicación :,978-84-01-02751-2,9788401027512,229 x 152 mm.,726 gramos,576,24-03-2022,"20,90","20,10",https://static.cegal.es/imagenes/marcadas/9788401/978840102751.gif
33,Pierde grasa con comida real,Una guía para alcanzar una composición corporal saludable,"Ríos, Carlos",Forma física y alimentación,Ediciones Paidós,Divulgación,Tapa blanda o Bolsillo,España,Castellano,Castellano,978-84-493-3918-9,9788449339189,233 x 155 mm.,542 gramos,320,16-03-2022,"17,95","17,26",https://static.cegal.es/imagenes/marcadas/9788449/978844933918.gif
34,Anhelo (Serie Crave 1),,"Wolff, Tracy",Ficción general (infantil/juvenil),Editorial Planeta,"Charques, Vicky",,Encuadernación:,País de publicación :,Idioma de publicación :,978-84-08-23299-5,9788408232995,230 x 150 mm.,732 gramos,672,22-09-2020,"18,50","17,79",https://static.cegal.es/imagenes/marcadas/9788408/978840823299.gif
35,Casa de cielo y aliento (Ciudad Medialuna 2),,"Maas, Sarah J.",Fantasía romántica (juvenil),ALFAGUARA,Ciudad Medialuna,Tapa blanda o Bolsillo,España,Castellano,Inglés,978-84-204-5925-7,9788420459257,217 x 152 mm.,975 gramos,832,03-03-2022,"19,95","19,18",https://static.cegal.es/imagenes/marcadas/9788420/978842045925.gif
36,La vida contada por un sapiens a un neandertal,,"Millás, Juan José / Arsuaga, Juan Luis",Antropología,ALFAGUARA,HISP?NICA,Tapa blanda o Bolsillo,España,Castellano,Castellano,978-84-204-3965-5,9788420439655,240 x 157 mm.,402 gramos,224,23-09-2020,"18,90","18,17",https://static.cegal.es/imagenes/marcadas/9788420/978842043965.gif
37,Blue Lock nº 01,,"Nomura, Yusuke",Edad de interés: a partir de 12 años,Planeta Cómic,"Bernal Asensio, Andrea",,Encuadernación:,País de publicación :,Idioma de publicación :,978-84-1112-374-7,9788411123747,177 x 111 mm.,220 gramos,208,23-03-2022,"7,95","7,64",https://static.cegal.es/imagenes/marcadas/9788411/978841112374.gif
38,Anna Kadabra 8. El festival de brujería,,"Mañas, Pedro / Sierra Listón, David",Brujas y fantasmas (infantil/juvenil),Destino Infantil & Juvenil,,Anna Kadabra,Tapa blanda o Bolsillo,España,Castellano,978-84-08-25135-4,9788408251354,200 x 140 mm.,278 gramos,128,09-03-2022,"9,95","9,57",https://static.cegal.es/imagenes/marcadas/9788408/978840825135.gif
39,Nunca,Por el autor de Los pilares de la Tierra,"Follett, Ken",Obra de suspense político y judicial,PLAZA & JANES,"Sastre Letona, Raúl",,Encuadernación:,País de publicación :,Idioma de publicación :,978-84-01-02705-5,9788401027055,240 x 158 mm.,1182 gramos,840,11-11-2021,"24,90","23,94",https://static.cegal.es/imagenes/marcadas/9788401/978840102705.gif
40,El cocinero del Alcyon (Comisario Montalbano 32),,"Camilleri, Andrea",Siglo xx,SALAMANDRA,"MAYOR ORTEGA, CARLOS",,Encuadernación:,País de publicación :,Idioma de publicación :,978-84-18681-01-1,9788418681011,221 x 139 mm.,320 gramos,240,17-03-2022,"18,00","17,31",https://static.cegal.es/imagenes/marcadas/9788418/978841868101.gif
41,El vizconde que me amó (Bridgerton 2),,"Quinn, Julia",Narrativa romántica histórica,Titania,"Arruti Illarramendi, Rosa",,Encuadernación:,País de publicación :,Idioma de publicación :,978-84-16327-82-9,9788416327829,225 x 150 mm.,454 gramos,352,07-01-2020,"15,00","14,42",https://static.cegal.es/imagenes/marcadas/9788416/978841632782.gif
42,La cuenta atrás para el verano,La vida son recuerdos y los míos tienen nombres de persona,La Vecina Rubia,Ficción moderna y contemporanea,Libros Cúpula,Novela,Tapa blanda o Bolsillo,España,Castellano,Castellano,978-84-480-2883-1,9788448028831,230 x 150 mm.,696 gramos,416,06-10-2021,"17,90","17,21",https://static.cegal.es/imagenes/marcadas/9788448/978844802883.gif
43,El italiano,,"Pérez-Reverte, Arturo",Ficción de guerra y combate,ALFAGUARA,Hispánica,Cartoné,España,Castellano,Castellano,978-84-204-6049-9,9788420460499,247 x 160 mm.,725 gramos,400,21-09-2021,"21,90","21,06",https://static.cegal.es/imagenes/marcadas/9788420/978842046049.gif
44,De sangre y cenizas,,"ARMENTROUT, JENNIFER",Fantasía y realismo mágico (infantil/juvenil),Puck,"Manso de Zuñiga Spottorno, Guiomar",,Encuadernación:,País de publicación :,Idioma de publicación :,978-84-17854-31-7,9788417854317,213 x 135 mm.,808 gramos,672,05-10-2021,"19,95","19,18",https://static.cegal.es/imagenes/marcadas/9788417/978841785431.gif
45,Todo lo que nunca fuimos,Deja que ocurra 1,"Kellen, Alice",Ficción moderna y contemporanea,Booket,Novela,Tapa blanda o Bolsillo,España,Castellano,Castellano,978-84-08-22195-1,9788408221951,190 x 125 mm.,228 gramos,352,16-01-2020,"8,95","8,61",https://static.cegal.es/imagenes/marcadas/9788408/978840822195.gif
46,Pokémon. Aventuras para colorear (Colección Pokémon),,"The Pokémon Company,",Libros de actividades para colorear y pintar,MONTENA,Colección Pokémon,Tapa blanda o Bolsillo,España,Castellano,Castellano,978-84-19169-30-3,9788419169303,269 x 211 mm.,354 gramos,96,24-03-2022,"5,95","5,72",https://static.cegal.es/imagenes/marcadas/9788419/978841916930.gif
47,La compañera (La Volátil),,"Guerrero, Agustina",Novelas gráficas: historias reales y no ficción,LUMEN,La Volátil,Cartoné,España,Castellano,Castellano,978-84-264-1101-3,9788426411013,247 x 208 mm.,989 gramos,232,10-03-2022,"20,90","20,10",https://static.cegal.es/imagenes/marcadas/9788426/978842641101.gif
48,El arte de engañar al karma,,"Benavent, Elísabet",Narrativa romántica adulta y contemporánea,DEBOLSILLO,BEST SELLER,Tapa blanda o Bolsillo,España,Castellano,Castellano,978-84-663-5937-5,9788466359375,190 x 127 mm.,480 gramos,696,03-03-2022,"9,95","9,57",https://static.cegal.es/imagenes/marcadas/9788466/978846635937.gif
49,TOKYO REVENGERS 04,,"WAKUI, KEN",Novelas gráficas: manga,NORMA EDITORIAL,TOKYO REVENGERS,Libro en otro formato,España,Castellano,Castellano,978-84-679-4710-6,9788467947106,210 x 140 mm.,200 gramos,400,25-02-2022,"16,00","15,38",https://static.cegal.es/imagenes/marcadas/9788467/978846794710.gif
50,El poder del ahora,Una guía para la iluminación espiritual,"Tolle, Eckhart","Mente, cuerpo y espíritu: pensamiento y práctica",Gaia Ediciones,"Iribarren Berrade, Miguel",,Encuadernación:,País de publicación :,Idioma de publicación :,978-84-8445-206-5,9788484452065,210 x 145 mm.,450 gramos,220,01-09-2007,"10,00","9,62",https://static.cegal.es/imagenes/marcadas/9788484/978848445206.gif
51,Lugar seguro,,"Rosa, Isaac",Ficción moderna y contemporanea,Seix Barral,Biblioteca Breve,Tapa blanda o Bolsillo,España,Castellano,Castellano,978-84-322-3983-0,9788432239830,230 x 133 mm.,409 gramos,312,09-03-2022,"19,90","19,13",https://static.cegal.es/imagenes/marcadas/9788432/978843223983.gif
52,Los siete maridos de Evelyn Hugo,,"Jenkins Reid, Taylor",Ficción histórica,Umbriel,"Escoms, Nora Inés",,Encuadernación:,País de publicación :,Idioma de publicación :,978-84-16517-27-5,9788416517275,230 x 150 mm.,510 gramos,384,04-02-2020,"17,00","16,35",https://static.cegal.es/imagenes/marcadas/9788416/978841651727.gif
53,Hamnet,,"O'Farrell, Maggie",Ficción histórica,Libros del Asteroide,"Cardeñoso, Concha",,Encuadernación:,País de publicación :,Idioma de publicación :,978-84-17977-58-0,9788417977580,215 x 140 mm.,460 gramos,352,22-02-2021,"23,95","23,03",https://static.cegal.es/imagenes/marcadas/9788417/978841797758.gif
54,Te doy mi corazón (Bridgerton 3),,"Quinn, Julia",Narrativa romántica histórica,Titania,Titania época,Tapa blanda o Bolsillo,España,Castellano,Inglés,978-84-16327-84-3,9788416327843,225 x 150 mm.,460 gramos,352,11-02-2020,"15,00","14,42",https://static.cegal.es/imagenes/marcadas/9788416/978841632784.gif
55,El poder,Un estratega lee a Maquiavelo,"Baños Bajo, Pedro",Gestión: liderazgo y motivación,Editorial Rosamerón,FUERA DE COLECCION,Tapa blanda o Bolsillo,España,Castellano,Castellano,978-84-124739-1-9,9788412473919,210 x 140 mm.,440 gramos,368,16-02-2022,"20,90","20,10",https://static.cegal.es/imagenes/marcadas/9788412/978841247391.gif
56,El duque y yo (Bridgerton 1),,"Quinn, Julia",Narrativa romántica histórica,Titania,"Terés Loriente, Mireia",,Encuadernación:,País de publicación :,Idioma de publicación :,978-84-16327-81-2,9788416327812,225 x 150 mm.,416 gramos,320,07-01-2020,"15,00","14,42",https://static.cegal.es/imagenes/marcadas/9788416/978841632781.gif
57,Una corona de sombras,,"Levenseller, Tricia",Fantasía romántica (juvenil),Crossbooks,"Simeoni, Rob",,Encuadernación:,País de publicación :,Idioma de publicación :,978-84-08-24927-6,9788408249276,225 x 145 mm.,600 gramos,384,16-03-2022,"16,95","16,30",https://static.cegal.es/imagenes/marcadas/9788408/978840824927.gif
58,Compas 6. Los Compas y la Entidad.Exe,,"Mikecrack, El Trollino y Timba Vk",Edad de interés: a partir de 9 años,Ediciones Martínez Roca,4You2,Cartoné,España,Castellano,Castellano,978-84-270-4882-9,9788427048829,230 x 150 mm.,732 gramos,224,01-12-2021,"19,90","19,13",https://static.cegal.es/imagenes/marcadas/9788427/978842704882.gif
59,Las aventuras de Dani y Evan 5. El tesoro del T-Rex dorado,,Las aventuras de Dani y Evan,Relatos de aventuras (infantil/juvenil),Destino Infantil & Juvenil,,Jóvenes influencers,Cartoné,España,Castellano,978-84-08-25255-9,9788408252559,215 x 150 mm.,360 gramos,144,23-02-2022,"12,95","12,45",https://static.cegal.es/imagenes/marcadas/9788408/978840825255.gif
60,Amanda Black 1 - Una herencia peligrosa,,"Gómez-Jurado, Juan / Montes, Bárbara",Edad de interés: a partir de 8 años,B de Blok,,Amanda Black,Cartoné,España,Castellano,978-84-17921-37-8,9788417921378,212 x 145 mm.,362 gramos,192,11-02-2021,"14,96","14,38",https://static.cegal.es/imagenes/marcadas/9788417/978841792137.gif
61,La vida anterior de los delfines,,"Uribe, Kirmen",Ficción moderna y contemporanea,Seix Barral,"Isasi Urdangarín, José María",,Encuadernación:,País de publicación :,Idioma de publicación :,978-84-322-3981-6,9788432239816,230 x 133 mm.,560 gramos,432,16-03-2022,"20,00","19,23",https://static.cegal.es/imagenes/marcadas/9788432/978843223981.gif
62,Anna Kadabra 1. El Club de la Luna Llena,,"Mañas, Pedro / Sierra Listón, David",Libros de cuentos ilustrados,Destino Infantil & Juvenil,,Anna Kadabra,Tapa blanda o Bolsillo,España,Castellano,978-84-08-22323-8,9788408223238,200 x 140 mm.,282 gramos,128,11-02-2020,"9,95","9,57",https://static.cegal.es/imagenes/marcadas/9788408/978840822323.gif
63,Furia (Serie Crave 2),,"Wolff, Tracy",Ficción general (infantil/juvenil),Editorial Planeta,"Charques, Vicky",,Encuadernación:,País de publicación :,Idioma de publicación :,978-84-08-24011-2,9788408240112,230 x 150 mm.,864 gramos,800,17-03-2021,"18,50","17,79",https://static.cegal.es/imagenes/marcadas/9788408/978840824011.gif
64,Pokémon Súper Extra Delux Guía esencial definitiva,,"The Pokémon Company,",Arte dramático y otras artes escénicas (infantil/juvenil),MONTENA,"ASTORZA LIGERO, ALICIA",,Encuadernación:,País de publicación :,Idioma de publicación :,978-84-18483-10-3,9788418483103,230 x 151 mm.,820 gramos,576,18-11-2021,"21,95","21,11",https://static.cegal.es/imagenes/marcadas/9788418/978841848310.gif
65,"Me quiero, te quiero",Una guía para desarrollar relaciones sanas (y mejorar las que ya tienes),"Esclapez, María",Psicología popular,Bruguera,Bruguera Tendencias,Tapa blanda o Bolsillo,España,Castellano,Castellano,978-84-02-42458-7,9788402424587,213 x 151 mm.,408 gramos,256,27-01-2022,"18,90","18,17",https://static.cegal.es/imagenes/marcadas/9788402/978840242458.gif
66,Fulgor (Serie Crave 4),,"Wolff, Tracy",Ficción general (infantil/juvenil),Editorial Planeta,"Traducciones Imposibles, S. L.",,Encuadernación:,País de publicación :,Idioma de publicación :,978-84-08-25200-9,9788408252009,230 x 150 mm.,1046 gramos,960,02-03-2022,"19,50","18,75",https://static.cegal.es/imagenes/marcadas/9788408/978840825200.gif
67,Hábitos atómicos,"Cambios pequeños, resultados extraordinarios","Clear, James","Mente, cuerpo y espíritu: pensamiento y práctica",Diana Editorial,"Moya, Gabriela",,Encuadernación:,País de publicación :,Idioma de publicación :,978-84-18118-03-6,9788418118036,230 x 150 mm.,542 gramos,336,08-09-2020,"17,95","17,26",https://static.cegal.es/imagenes/marcadas/9788418/978841811803.gif
68,A través de mi ventana (Trilogía Hermanos Hidalgo 1),,"Godoy, Ariana",Cuestiones personales y sociales: sexualidad y relaciones interpersonales (infantil/juvenil),ALFAGUARA,Trilogía Hermanos Hidalgo,Tapa blanda o Bolsillo,España,Castellano,Castellano,978-84-204-5191-6,9788420451916,216 x 152 mm.,515 gramos,416,16-05-2019,"18,95","18,22",https://static.cegal.es/imagenes/marcadas/9788420/978842045191.gif
69,Los 150 chistes favoritos de Timba Vk,,Timba VK,Antologías (infantil/juvenil),Ediciones Martínez Roca,4You2,Cartoné,España,Castellano,Castellano,978-84-270-4928-4,9788427049284,240 x 160 mm.,626 gramos,160,19-01-2022,"14,90","14,33",https://static.cegal.es/imagenes/marcadas/9788427/978842704928.gif
70,A orillas del mar (Premio Nobel de Literatura 2021),,"Gurnah, Abdulrazak",Siglo xxi,SALAMANDRA,"Antón, Patricia",,Encuadernación:,País de publicación :,Idioma de publicación :,978-84-18968-07-5,9788418968075,221 x 140 mm.,444 gramos,352,24-03-2022,"20,00","19,23",https://static.cegal.es/imagenes/marcadas/9788418/978841896807.gif
71,"Futuro, ¿qué futuro?",Claves para sobrevivir más allá de la pandemia,"Niño-Becerra, Santiago",Crisis y desastres económicos y financieros,Editorial Ariel,Ariel,Tapa blanda o Bolsillo,España,Castellano,Castellano,978-84-344-3516-2,9788434435162,230 x 145 mm.,410 gramos,256,23-03-2022,"19,90","19,13",https://static.cegal.es/imagenes/marcadas/9788434/978843443516.gif
72,Malas mujeres,,"Hesse, María",Colección de biografías,LUMEN,Lumen Gráfica,Cartoné,España,Castellano,Castellano,978-84-264-0969-0,9788426409690,247 x 181 mm.,658 gramos,168,01-02-2022,"21,90","21,06",https://static.cegal.es/imagenes/marcadas/9788426/978842640969.gif
73,La chica de nieve,,"Castillo, Javier",Ficción moderna y contemporanea,DEBOLSILLO,BEST SELLER,Tapa blanda o Bolsillo,España,Castellano,Castellano,978-84-663-5709-8,9788466357098,190 x 127 mm.,364 gramos,512,24-02-2022,"10,95","10,53",https://static.cegal.es/imagenes/marcadas/9788466/978846635709.gif
74,Asesino de brujas,La bruja blanca,"MAHURIN, SHELBY",Fantasía y realismo mágico (infantil/juvenil),Puck,"Taboada, Daniela Rocío",,Encuadernación:,País de publicación :,Idioma de publicación :,978-84-92918-79-9,9788492918799,213 x 135 mm.,594 gramos,480,14-01-2020,"16,50","15,87",https://static.cegal.es/imagenes/marcadas/9788492/978849291879.gif
75,El infinito en un junco,La invención de los libros en el mundo antiguo,"Vallejo, Irene",Ensayos literarios,Siruela,Biblioteca de Ensayo / Serie mayor,Tapa blanda o Bolsillo,España,Castellano,Castellano,978-84-17860-79-0,9788417860790,230 x 150 mm.,744 gramos,452,10-01-2022,"24,95","23,99",https://static.cegal.es/imagenes/marcadas/9788417/978841786079.gif
